{
  "protocol_version": "1.0.0",
  "scenario_id": "confirmation",
  "run_id": "fx-run-001",
  "call_or_session_id": "fx-call-001",
  "environment": {
    "name": "validation-sandbox",
    "version": "m7-template"
  },
  "timestamps": {
    "prepared_at": "2026-01-01T10:00:00Z",
    "completed_at": "2026-01-01T10:02:00Z"
  },
  "observed_outcome": {
    "result": "appointment_confirmed",
    "summary": "Fictitious template outcome only."
  },
  "governance_trace": [
    {
      "kind": "session",
      "reference": "fx-session-001"
    }
  ],
  "evidence": [
    {
      "kind": "report",
      "name": "m7-v1-confirmation-fx-call-001-report-r1.json"
    }
  ],
  "diagnostics": [],
  "verdict": "PASS"
}
